{
  "schema_version": "1.0",
  "draft_type": "requirement",
  "target_model": "app.transaction.schemas.RequirementWrite",
  "fields": [
    {"draft_field": "draft_id", "target_field": null, "disposition": "assistant_only", "source_policy": ["existing_record"], "hard_fact": false, "confirmation": "not_required", "required_for_preview": false, "required_for_save": true, "required_for_publish": false, "notes": "服务端生成，只用于副驾草稿读取和幂等交接。"},
    {"draft_field": "draft_version", "target_field": null, "disposition": "assistant_only", "source_policy": ["existing_record"], "hard_fact": false, "confirmation": "not_required", "required_for_preview": false, "required_for_save": true, "required_for_publish": false, "notes": "服务端并发控制版本。"},
    {"draft_field": "organization_id", "target_field": "organization_id", "disposition": "mapped", "source_policy": ["user_choice", "user_edit", "existing_record"], "hard_fact": true, "confirmation": "required", "required_for_preview": false, "required_for_save": false, "required_for_publish": true, "validation": "服务端校验当前用户为企业负责人或业务管理员。"},
    {"draft_field": "title", "target_field": "title", "disposition": "mapped", "source_policy": ["user_message", "user_choice", "user_edit", "ai_expansion"], "hard_fact": false, "confirmation": "required_if_present", "required_for_preview": false, "required_for_save": false, "required_for_publish": true, "validation": "trim 后 4 至 100 字。"},
    {"draft_field": "category", "target_field": "category", "disposition": "mapped", "source_policy": ["user_message", "user_choice", "user_edit", "ai_expansion", "existing_record"], "hard_fact": false, "confirmation": "required_if_present", "required_for_preview": false, "required_for_save": false, "required_for_publish": true, "validation": "首期为受控分类名称，trim 后 2 至 80 字。"},
    {"draft_field": "background", "target_field": "description", "disposition": "mapped", "source_policy": ["user_message", "user_choice", "user_edit", "attachment_extraction", "ai_expansion"], "hard_fact": false, "confirmation": "required_if_present", "required_for_preview": false, "required_for_save": false, "required_for_publish": false, "transform": "写入描述的背景小节。"},
    {"draft_field": "goal", "target_field": "description", "disposition": "mapped", "source_policy": ["user_message", "user_choice", "user_edit", "attachment_extraction", "ai_expansion"], "hard_fact": false, "confirmation": "required_if_present", "required_for_preview": true, "required_for_save": false, "required_for_publish": true, "transform": "写入描述的目标小节。"},
    {"draft_field": "target_audience", "target_field": "description", "disposition": "mapped", "source_policy": ["user_message", "user_choice", "user_edit", "attachment_extraction", "ai_expansion"], "hard_fact": false, "confirmation": "required_if_present", "required_for_preview": false, "required_for_save": false, "required_for_publish": false, "transform": "与 use_scenario 至少一项存在，写入描述的对象与场景小节。"},
    {"draft_field": "use_scenario", "target_field": "description", "disposition": "mapped", "source_policy": ["user_message", "user_choice", "user_edit", "attachment_extraction", "ai_expansion"], "hard_fact": false, "confirmation": "required_if_present", "required_for_preview": false, "required_for_save": false, "required_for_publish": false, "transform": "与 target_audience 至少一项存在，写入描述的对象与场景小节。"},
    {"draft_field": "service_scope", "target_field": "description", "disposition": "mapped", "source_policy": ["user_message", "user_choice", "user_edit", "attachment_extraction", "ai_expansion"], "hard_fact": false, "confirmation": "required_if_present", "required_for_preview": false, "required_for_save": false, "required_for_publish": false, "transform": "按稳定顺序写入服务范围小节。"},
    {"draft_field": "exclusions", "target_field": "description", "disposition": "mapped", "source_policy": ["user_message", "user_choice", "user_edit", "attachment_extraction", "ai_expansion"], "hard_fact": false, "confirmation": "required_if_present", "required_for_preview": false, "required_for_save": false, "required_for_publish": false, "transform": "按稳定顺序写入排除项小节，禁止静默丢弃。"},
    {"draft_field": "risks", "target_field": "description", "disposition": "mapped", "source_policy": ["user_message", "user_choice", "user_edit", "attachment_extraction", "ai_expansion"], "hard_fact": false, "confirmation": "required_if_present", "required_for_preview": false, "required_for_save": false, "required_for_publish": false, "transform": "按稳定顺序写入风险小节。"},
    {"draft_field": "dependencies", "target_field": "description", "disposition": "mapped", "source_policy": ["user_message", "user_choice", "user_edit", "attachment_extraction", "ai_expansion"], "hard_fact": false, "confirmation": "required_if_present", "required_for_preview": false, "required_for_save": false, "required_for_publish": false, "transform": "按稳定顺序写入依赖小节。"},
    {"draft_field": "budget_min", "target_field": "budget_min_amount", "disposition": "mapped", "source_policy": ["user_message", "user_choice", "user_edit"], "hard_fact": true, "confirmation": "required", "required_for_preview": false, "required_for_save": false, "required_for_publish": true, "validation": "Decimal，必须大于等于 0。"},
    {"draft_field": "budget_max", "target_field": "budget_max_amount", "disposition": "mapped", "source_policy": ["user_message", "user_choice", "user_edit"], "hard_fact": true, "confirmation": "required", "required_for_preview": false, "required_for_save": false, "required_for_publish": true, "validation": "Decimal，必须大于 0 且不小于下限。"},
    {"draft_field": "currency", "target_field": null, "disposition": "server_derived", "source_policy": ["user_choice", "user_edit", "system_default"], "hard_fact": true, "confirmation": "required", "required_for_preview": false, "required_for_save": true, "required_for_publish": true, "validation": "当前只允许 CNY；系统默认不得被当作用户已确认。"},
    {"draft_field": "schedule", "target_field": "desired_delivery_at", "disposition": "mapped", "source_policy": ["user_message", "user_choice", "user_edit"], "hard_fact": true, "confirmation": "required", "required_for_preview": true, "required_for_save": false, "required_for_publish": true, "transform": "deadline 直接规范化；duration 按用户时区、起算时间和工作日历换算后再次确认；undecided 阻断真实草稿创建。"},
    {"draft_field": "visibility", "target_field": "visibility", "disposition": "mapped", "source_policy": ["user_choice", "user_edit", "existing_record"], "hard_fact": true, "confirmation": "required", "required_for_preview": false, "required_for_save": false, "required_for_publish": true, "validation": "public、enterprise、invited_providers 之一。"},
    {"draft_field": "invite_limit", "target_field": "invite_limit", "disposition": "mapped", "source_policy": ["user_choice", "user_edit"], "hard_fact": true, "confirmation": "required", "required_for_preview": false, "required_for_save": false, "required_for_publish": true, "validation": "1 至 20；系统默认不得当作已确认。"},
    {"draft_field": "confidentiality_level", "target_field": "confidentiality_level", "disposition": "mapped", "source_policy": ["user_choice", "user_edit"], "hard_fact": true, "confirmation": "required", "required_for_preview": false, "required_for_save": false, "required_for_publish": true, "validation": "standard、confidential、highly_confidential 之一；不得用 visibility 替代。"},
    {"draft_field": "deliverables", "target_field": "deliverables", "disposition": "mapped", "source_policy": ["user_message", "user_choice", "user_edit", "attachment_extraction", "ai_expansion"], "hard_fact": false, "confirmation": "required_if_present", "required_for_preview": true, "required_for_save": false, "required_for_publish": true, "validation": "至少一条，结构为 name、format、required。"},
    {"draft_field": "acceptance_criteria", "target_field": "acceptance_criteria", "disposition": "mapped", "source_policy": ["user_message", "user_choice", "user_edit", "attachment_extraction", "ai_expansion"], "hard_fact": false, "confirmation": "required_if_present", "required_for_preview": false, "required_for_save": false, "required_for_publish": true, "validation": "至少一条非空字符串。"},
    {"draft_field": "attachments", "target_field": "attachments", "disposition": "mapped", "source_policy": ["user_choice", "user_edit", "existing_record"], "hard_fact": true, "confirmation": "required_if_present", "required_for_preview": false, "required_for_save": false, "required_for_publish": false, "transform": "只提交服务端可解析的 file_id；重新校验租户、企业、上传者、扫描状态和候选方查看授权。"},
    {"draft_field": "missing_fields", "target_field": null, "disposition": "assistant_only", "source_policy": ["existing_record"], "hard_fact": false, "confirmation": "not_required", "required_for_preview": false, "required_for_save": true, "required_for_publish": false, "notes": "副驾草稿可保存缺失项，但真实需求创建前必须为空。"},
    {"draft_field": "change_summary", "target_field": "change_summary", "disposition": "mapped", "source_policy": ["user_edit", "existing_record", "system_default"], "hard_fact": false, "confirmation": "not_required", "required_for_preview": false, "required_for_save": false, "required_for_publish": false, "notes": "首版由服务端记录为由开小花生成并经用户确认。"}
  ]
}
